{
  "$schema": "https://json-schema.org/draft/2020-12/schema",
  "$id": "agent.schema.json",
  "title": "AgentBundleProfile",
  "description": "Bundle-side spec; deploy script translates into a Tangle Sandbox AgentProfile and emits harness-native files (AGENTS.md, agents.json) at the workspace root.",
  "type": "object",
  "required": ["name", "version", "prompt"],
  "additionalProperties": false,
  "properties": {
    "name": { "type": "string" },
    "description": { "type": "string" },
    "version": { "type": "string" },
    "tags": { "type": "array", "items": { "type": "string" } },
    "harness": {
      "type": "string",
      "enum": ["opencode", "claude-code", "hermes"],
      "description": "Default harness for this bundle. CLI --harness flag overrides at deploy time."
    },
    "hooks": {
      "type": "object",
      "additionalProperties": false,
      "description": "Optional pre/post deploy hooks. Pre runs locally before sandbox.create. Post runs inside the sandbox after files.write, before any task().",
      "properties": {
        "pre": { "type": "string", "description": "Path (relative to bundle root) of a script to run on the deploying machine before sandbox.create." },
        "post": { "type": "string", "description": "Path (relative to bundle root) of a script to push into the sandbox and execute after files.write." }
      }
    },
    "workspace": {
      "type": "object",
      "additionalProperties": false,
      "description": "Sandbox workspace layout. Defaults to OpenCode/Claude/Hermes harness convention at /home/agent.",
      "properties": {
        "root": {
          "type": "string",
          "description": "Absolute path inside the sandbox where AGENTS.md, agents.json, and resource files are emitted. Defaults to /home/agent."
        }
      }
    },
    "prompt": {
      "type": "object",
      "additionalProperties": false,
      "properties": {
        "systemPromptFile": {
          "type": "string",
          "description": "Relative path to the orchestrator's system prompt. Conventionally AGENTS.md (auto-loaded by the harness); content is also pushed via AgentProfile.prompt.systemPrompt."
        },
        "instructions": { "type": "array", "items": { "type": "string" } }
      }
    },
    "model": {
      "type": "object",
      "additionalProperties": false,
      "properties": {
        "preferred": { "type": "string" },
        "fallback": { "type": "array", "items": { "type": "string" } }
      }
    },
    "tools": { "type": "object", "additionalProperties": { "type": "boolean" } },
    "permissions": { "type": "object", "additionalProperties": { "enum": ["allow", "ask", "deny"] } },
    "mcp": { "type": "object" },
    "subagents": {
      "type": "object",
      "description": "For multi-agent bundles only. Each entry is emitted into <workspace.root>/agents.json under the OpenCode subagent shape: { mode: 'subagent', description, prompt, tools, permission, temperature }.",
      "additionalProperties": {
        "type": "object",
        "required": ["systemPromptFile"],
        "additionalProperties": false,
        "properties": {
          "description": { "type": "string" },
          "systemPromptFile": { "type": "string" },
          "model": { "type": "string" },
          "tools": { "type": "object", "additionalProperties": { "type": "boolean" } },
          "permissions": { "type": "object", "additionalProperties": { "enum": ["allow", "ask", "deny"] } },
          "temperature": { "type": "number", "minimum": 0 },
          "maxSteps": { "type": "integer", "minimum": 1 }
        }
      }
    },
    "resources": {
      "type": "object",
      "additionalProperties": false,
      "properties": {
        "files": {
          "type": "array",
          "items": {
            "type": "object",
            "required": ["source"],
            "additionalProperties": false,
            "properties": {
              "source": { "type": "string", "description": "Relative to bundle root; file or directory." },
              "target": {
                "type": "string",
                "description": "Path inside the sandbox. If relative, treated as relative to <workspace.root>. Defaults to <workspace.root>/<source>."
              }
            }
          }
        }
      }
    }
  }
}
