{
  "name": "photographer",
  "description": "Creative photographer agent bundle — composition coaching, lighting setup design, and post-production workflow guidance. Works alongside a photographer as a thinking partner for shot planning, gear selection, and creative direction. Not a substitute for hands-on experience or professional critique.",
  "version": "0.1.0",
  "tags": [
    "agent-runtime",
    "photographer",
    "creative-agent",
    "composition",
    "lighting",
    "post-production",
    "cloudflare-worker"
  ],
  "prompt": {
    "systemPromptFile": "AGENTS.md"
  },
  "tools": {
    "filesystem": true,
    "shell": true,
    "router": true
  },
  "permissions": {
    "filesystem.write": "ask",
    "shell.exec": "ask",
    "network": "ask"
  },
  "resources": {
    "files": [
      {
        "source": "methodology/",
        "target": "/workspace/methodology/"
      },
      {
        "source": "README.md",
        "target": "/workspace/README.md"
      },
      {
        "source": "TOOLS.md",
        "target": "/workspace/TOOLS.md"
      }
    ]
  }
}
