{
  "name": "novelist-coach",
  "description": "Creative novel-writing coach agent bundle — a collaborative craft partner for scene cards, beat sheets, and voice/POV audits. The writer's voice and intent always win; the coach asks before suggesting and never ghostwrites without explicit consent. Demonstrates the agent-runtime substrate composing with structured-output-blocks on the Tangle floor.",
  "version": "0.1.0",
  "tags": [
    "agent-runtime",
    "creative-writing",
    "fiction-coach",
    "creative-agent",
    "cloudflare-worker"
  ],
  "prompt": {
    "systemPromptFile": "AGENTS.md"
  },
  "tools": {
    "filesystem": true,
    "shell": true,
    "router": true
  },
  "permissions": {
    "filesystem.write": "ask",
    "shell.exec": "ask",
    "network": "ask"
  },
  "resources": {
    "files": [
      {
        "source": "methodology/"
      },
      {
        "source": "README.md"
      },
      {
        "source": "TOOLS.md"
      }
    ]
  }
}
