{
  "name": "product-manager",
  "description": "Product management agent bundle — helps operators define product strategy, prioritize features, and run discovery cycles. Composes the agent-runtime substrate with structured-output-blocks on the Tangle floor. Advisory only — never replaces the operator's product team or board.",
  "version": "0.1.0",
  "tags": [
    "agent-runtime",
    "product-management",
    "advisory-agent",
    "product-strategy",
    "prioritization",
    "cloudflare-worker"
  ],
  "prompt": {
    "systemPromptFile": "AGENTS.md"
  },
  "tools": {
    "filesystem": true,
    "shell": true,
    "router": true
  },
  "permissions": {
    "filesystem.write": "ask",
    "shell.exec": "ask",
    "network": "ask"
  },
  "resources": {
    "files": [
      {
        "source": "methodology/",
        "target": "/workspace/methodology/"
      },
      {
        "source": "README.md",
        "target": "/workspace/README.md"
      },
      {
        "source": "TOOLS.md",
        "target": "/workspace/TOOLS.md"
      }
    ]
  }
}
