{
  "name": "research-lab",
  "description": "Curated multi-agent research lab — Lab Director coordinating Physics / Chemistry / Biology researchers with literature-triage and cross-domain synthesis. Director is the default respondent and owns synthesis.",
  "version": "0.1.0",
  "tags": [
    "multi-agent",
    "team",
    "research",
    "lab",
    "literature-triage",
    "cross-domain"
  ],
  "prompt": {
    "systemPromptFile": "AGENTS.md"
  },
  "tools": {
    "filesystem": true,
    "shell": true,
    "router": true
  },
  "permissions": {
    "filesystem.write": "ask",
    "shell.exec": "ask",
    "network": "ask"
  },
  "subagents": {
    "lab-director": {
      "description": "Lab Director — research-question formulation, cross-domain synthesis, literature triage. Default respondent. Owns the synthesis turn on cross-domain questions.",
      "systemPromptFile": "roles/lab-director/AGENTS.md",
      "tools": {
        "filesystem": true,
        "router": true
      }
    },
    "physics-researcher": {
      "description": "Physics Researcher — arXiv literature search, experimental design. Mechanics / quantum / cosmology / condensed-matter / instrumentation.",
      "systemPromptFile": "roles/physics-researcher/AGENTS.md",
      "tools": {
        "filesystem": true,
        "router": true
      }
    },
    "chemistry-researcher": {
      "description": "Chemistry Researcher — reaction-mechanism analysis, CrossRef literature search. Synthesis / kinetics / catalysis / spectroscopy / materials chemistry.",
      "systemPromptFile": "roles/chemistry-researcher/AGENTS.md",
      "tools": {
        "filesystem": true,
        "router": true
      }
    },
    "biology-researcher": {
      "description": "Biology Researcher — protein-structure analysis, bioinformatics survey. Molecular / cellular / genomics / structural-bio / systems bio.",
      "systemPromptFile": "roles/biology-researcher/AGENTS.md",
      "tools": {
        "filesystem": true,
        "router": true
      }
    }
  },
  "resources": {
    "files": [
      {
        "source": "roles/"
      },
      {
        "source": "README.md"
      }
    ]
  }
}
