{
  "name": "account-executive",
  "description": "Account Executive agent bundle — pipeline management, deal progression, and forecast hygiene. Works alongside a sales operator on opportunity scoring, MEDDIC/MEDDPICC qualification, and weekly pipeline reviews. Advisory only — never replaces the operator's CRM, manager, or compensation plan.",
  "version": "0.1.0",
  "tags": [
    "agent-runtime",
    "account-executive",
    "sales-ae",
    "pipeline-management",
    "deal-progression",
    "forecast-hygiene",
    "cloudflare-worker"
  ],
  "prompt": {
    "systemPromptFile": "system-prompt.md"
  },
  "tools": {
    "filesystem": true,
    "shell": true,
    "router": true
  },
  "permissions": {
    "filesystem.write": "ask",
    "shell.exec": "ask",
    "network": "ask"
  },
  "resources": {
    "files": [
      {
        "source": "methodology/",
        "target": "/workspace/methodology/"
      },
      {
        "source": "README.md",
        "target": "/workspace/README.md"
      },
      {
        "source": "TOOLS.md",
        "target": "/workspace/TOOLS.md"
      }
    ]
  }
}
