{
  "name": "startup-team",
  "description": "Curated multi-agent startup leadership team — CEO / CTO / CMO / HR / CFO-advisor with hand-tuned coordination protocols, explicit handoff blocks, and a default-respondent routing rule.",
  "version": "0.1.0",
  "tags": ["multi-agent", "team", "startup", "advisory", "exec-pod", "leadership-team-agent"],
  "prompt": {
    "systemPromptFile": "orchestrator-system-prompt.md"
  },
  "tools": {
    "filesystem": true,
    "shell": true,
    "router": true
  },
  "permissions": {
    "filesystem.write": "ask",
    "shell.exec": "ask",
    "network": "ask"
  },
  "subagents": {
    "ceo": {
      "description": "Chief Executive — strategy, OKRs, weekly review, decision journal, board prep. Default respondent for ambiguous or cross-role questions.",
      "systemPromptFile": "roles/ceo/system-prompt.md",
      "tools": { "filesystem": true, "router": true }
    },
    "cto": {
      "description": "Chief Technology Officer — engineering 1:1 cadence, sprint planning, tech-debt triage, architecture decisions, postmortems.",
      "systemPromptFile": "roles/cto/system-prompt.md",
      "tools": { "filesystem": true, "router": true }
    },
    "cmo": {
      "description": "Chief Marketing Officer — positioning canvas, ICP research, channel experiment design, growth scoreboard.",
      "systemPromptFile": "roles/cmo/system-prompt.md",
      "tools": { "filesystem": true, "router": true }
    },
    "hr": {
      "description": "Talent and recruiting — JD drafting, structured interview rubrics, recruiting loop design, comp-band hygiene. Refuses protected-class filtering; defaults to structured interviews.",
      "systemPromptFile": "roles/hr/system-prompt.md",
      "tools": { "filesystem": true, "router": true }
    },
    "cfo-advisor": {
      "description": "Finance advisor (NOT licensed) — burn / runway modeling, unit economics, fundraise prep, board financials. Discloses 'not a licensed advisor' before any number.",
      "systemPromptFile": "roles/cfo-advisor/system-prompt.md",
      "tools": { "filesystem": true, "router": true }
    }
  },
  "resources": {
    "files": [
      { "source": "roles/", "target": "/workspace/roles/" },
      { "source": "coordination-protocol.md", "target": "/workspace/coordination-protocol.md" },
      { "source": "agent-roster.json", "target": "/workspace/agent-roster.json" },
      { "source": "README.md", "target": "/workspace/README.md" }
    ]
  }
}
